step,object,x,y,zoom,page,question,answer,alt_text,layer1_button,layer1_content,layer2_button,layer2_content,clip_start,clip_end,loop
paso,objeto,x,y,zoom,pagina,pregunta,respuesta,texto_alt,boton1,contenido1,boton2,contenido2,inicio_clip,fin_clip,bucle
1,11291778987193pic,0.4447904406071249,0.5717612491951839,2.284306569343065,,What form of everyday love can we observe among UCSB students sharing meals in Carrillo Dining Hall？,"Inside Carrillo Dining Hall, several groups of friends sat together eating dinner, talking, and laughing. Some students listened carefully while others shared stories about their day. The atmosphere felt relaxed and supportive. Many students maintained eye contact during conversations and several groups sat closely together around shared tables. Although this interaction appeared simple, it reflected an important form of friendship and emotional support within college life.
This moment demonstrates how friendship can reduce stress and create a sense of belonging for students at UCSB. After a long day of studying and attending classes, students used shared meals and conversation as a way to emotionally reconnect with one another. The interaction showed that love does not always need dramatic expression. Sometimes love appears through ordinary companionship and attentive listening.
This observation connects to Emily Esfahani Smith’s article “The Secret to Love is Just Kindness.” Smith argues that love is often expressed through small acts of kindness and emotional connection. This scene supports her idea because the students created warmth and emotional comfort simply by spending time together and listening to each other. Their casual interactions reflected everyday care and genuine friendship that helped build emotional stability and social belonging.

Hotspot 1: This close table seating and relaxed eye contact among students reflects everyday friendship care, matching Smith’s idea that small kind interactions build emotional connection.

Hotspot 2: This individual student within a shared dining hall group shows how campus community creates quiet emotional safety and belonging.","Groups of UCSB students sit together eating, talking, and laughing at Carrillo Dining Hall, showing supportive friendship and everyday love.",,,,,,,