step,object,x,y,zoom,page,question,answer,alt_text,layer1_button,layer1_content,layer2_button,layer2_content,clip_start,clip_end,loop
paso,objeto,x,y,zoom,pagina,pregunta,respuesta,texto_alt,boton1,contenido1,boton2,contenido2,inicio_clip,fin_clip,bucle
1,11301778987225pic,0.5,0.5,1,,How does romantic love appear as mutual academic collaboration and emotional support in ordinary campus spaces？,"Inside the UCSB Campus Store, I observed a couple sitting together on the red couch working on homework. They shared a laptop and had open notebooks resting on their laps. When the girl became confused about a problem, the boy leaned closer and quietly explained the answer while pointing at the notes. Their interaction appeared natural and emotionally supportive.
This observation reflects romantic love expressed through collaboration and mutual care. Instead of showing affection through dramatic behavior, the couple demonstrated emotional reliability through academic support, patient communication, and collaboration. Their interaction showed how romantic relationships can create psychological safety during stressful situations like studying and completing assignments.
This scene connects to Arthur C. Brooks’s article “Love Is Medicine for Fear.” Brooks explains that love helps reduce fear, anxiety, and emotional stress through trust and emotional connection. This observation supports his argument because the couple created a calm and secure environment for each other during a stressful academic moment through shared collaboration. Their emotional closeness and supportive communication helped reduce frustration and encouraged confidence.
The interaction also demonstrated that love is not only emotional but also practical. By helping each other solve problems and practicing academic collaboration together, the couple strengthened their relationship through these everyday acts of support and understanding.
Hotspot 1: Side‑by‑side couch seating and quiet collaborative study shows intimate romantic trust, supporting Brooks’s idea that love provides psychological safety under academic stress.
Hotspot 2: The student pointing at notebook notes reflects patient one on one romantic care.",,,,,,,,